Media,title,article
wsj,Main Street: It's Susan Collins's Moment,"If Brett Kavanaugh were on trial for sexual assault, all he'd need do is demonstrate reasonable doubt about the charges being made against him. But a Republican nominee to the Supreme Court is tried in the media, where Mr. Kavanaugh must now do the impossible: prove an assault never happened.Christine Blasey Ford alleges that at a high-school party 36 years ago, 17-year-old Brett Kavanaugh pinned her to a bed, tried to remove her clothes, and covered her mouth so she couldn't scream. Ms. Ford, now a professor at California's Palo Alto University, says she was able to flee the room only after a friend of Mr. Kavanaugh's, Mark Judge, jumped on top of them and they all tumbled off the bed. Ms. Ford further says she didn't tell anyone what happened at the time.Judge Kavanaugh's denial is categorical: ""I have never done anything like what the accuser describes -- to her or anyone,"" he said in a statement Monday. Mr. Judge likewise denies it all. ""It's just absolutely nuts,"" he told the Weekly Standard. ""I never saw Brett act that way.""The truth is, no one knows what went on in that Maryland bedroom at that party -- or if Mr. Kavanaugh was even there. Absent corroborating testimony, even the Federal Bureau of Investigation would have no way to reveal much more.So here we are, just days before what should have been a Thursday vote in the Senate Judiciary Committee. Since Ms. Ford's name became public, one member of that committee, Jeff Flake, the retiring Republican from Arizona, announced he wouldn't feel comfortable going ahead with a vote without a fuller airing of Ms. Ford's complaint. In a committee of 11 Republicans and 10 Democrats, Mr. Flake would give the Democrats the majority they need to stall a vote.Republicans Bob Corker, the retiring senator from Tennessee, and Alaska's Lisa Murkowski have also come out against holding a vote until Ms. Ford can be heard. They are joined by Democratic incumbents facing tight election races in states carried by Donald Trump: Joe Donnelly (Ind.), Heidi Heitkamp (N.D.) and Joe Manchin (W.Va.). Though Democrats would love to kill the Kavanaugh nomination, the more practical aim is a lengthy delay that would spare these Democrats a tough vote before the November midterms.But there's another senator who may hold the key to whether the GOP hangs together or heads for the tall grass. On Sunday Maine Republican Susan Collins told the New York Times that she considers the allegations of sexual assault serious and wants Ms. Ford interviewed to get her whole story. Just as telling, she made clear she finds the low and the last-minute nature of the way the Democrats handled the charges fishy.""If they believed Professor Ford, why didn't they surface this information earlier so that he could be questioned about it?"" Ms. Collins said. ""And if they didn't believe her and chose to withhold the information, why did they decide at the 11th hour to release it? It is really not fair to either of them the way it was handled.""Ms. Collins's complaints about fairness aren't easily dismissed. She's a strong advocate for women's rights; she announced in 2016 she wouldn't vote for Donald Trump; and she hasn't been afraid to buck her party, as when she voted against ObamaCare repeal. She's also firmly pro-choice but recently stood up to a nasty crowdfunding effort to bribe her into voting against Judge Kavanaugh over claims he would overturn Roe v. Wade.In remarks to reporters Monday afternoon, Ms. Collins called for accuser and accused to testify before the Judiciary Committee under oath. Not long after that, the Judiciary Committee scheduled a one-day hearing Monday on the issue. Ms. Ford and Judge Kavanaugh will each be heard.This is a risky accommodation, because the media and Democrats won't be satisfied no matter what Republicans do. But if it provides the space GOP senators need to move ahead to confirm Judge Kavanaugh, it may be the least damaging accommodation. The test is whether the hearing serves the purpose of keeping confirmation process close to schedule, or whether it will be turn into what the Democrats are really pushing for: the first of many delaying actions to come -- what one Judiciary Committee staffer describes as ""Borking 2.0.""By all means let's hear what Ms. Ford has to say. But let us hope Ms. Collins insists it not be at the expense of fairness to Judge Kavanaugh. Because right now the effort to put off his confirmation votes seems aimed at establishing an odious, new post-hearing precedent, whereby a single, inconclusive and uncorroborated #MeToo accusation can upend all Senate norms and leave a man with an otherwise sterling reputation twisting in the wind."
wsj,Christine Blasey Ford vs. Brett Kavanaugh,"Regarding your editorial ""The #MeToo Kavanaugh Ambush"" (Sept. 18): I am watching with anger and sadness the Democrats' last-ditch effort to derail the confirmation of Judge Brett Kavanaugh for the Supreme Court. I wonder if the Democrats have thought this tactic out. If it works with an unverifiable accusation, who will be safe in the contentious midterm political campaign season finale in November? If Judge Kavanaugh, who has an impeccable reputation going back decades and has been through six very thorough background checks by the FBI, can be destroyed, who can't be?Nancy IngalsbeeAllegan, Mich.---As a wife and mother of a teenage son, I have sympathy for Christine Blasey Ford but find Mr. Kavanaugh's predicament truly terrifying. Ms. Ford doesn't know the day, month or even the exact year the alleged attack occurred. She doesn't describe herself as being drugged or drunk on arrival at the party, yet she seems unable to recall the address or even the general location of the house where the incident allegedly occurred, remembering only that it was somewhere in Montgomery County, Md. Presumably too young to drive, Ms. Ford cannot explain how she arrived at the party or how she returned home. She does remember wearing a swimsuit and being attacked by Mr. Kavanaugh in a bedroom, with Mark Judge looking on. Mr. Judge, the only other party guest whose name Ms. Ford can recall, vehemently denies the incident ever happened. Notes from a 2012 therapist visit by Ms. Ford reference the supposed attack, but don't mention Mr. Kavanaugh by name and contradict Ms. Ford's account of the number of people present.Putting aside the utterly suspicious timing of the claim, how is Mr. Kanvanaugh supposed to defend himself against a charge that lacks any specificity whatsoever? How would your husband or son defend himself? If a qualified Supreme Court nominee can be derailed by an 11th-hour, 36-year-old attempted assault allegation that lacks a location, date, time and any witnesses, then the #MeToo movement has become a mockery.Ronda RossAustin, Texas---My heart goes out to Judge Kavanaugh's young daughters and his wife who must live through this nightmare of allegations against their father and husband, respectively, that will forever cloud their lives. The #MeToo movement has gone too far when women use ""women's rights"" as an excuse to push an at best murky narrative of abuse that cannot be remembered in detail by the accuser or confirmed by credible evidence.Sign me up for the #WhatGoesRoundComesRound movement, which I hope catches up with women who carelessly use their gender to destroy the reputation of other human beings.Helen AldersonKennett Square, Pa.---As an 81-year-old woman I can still recall, after 70 years, an attempted sexual assault that happened to me. It is as clear to me now as the night it happened. I don't remember the names of any other families I babysat for, but I shall never forget my assailant's name. If he were alive, I am confident he would say he couldn't recall that anything happened.Most men in no way understand the emotional impact unwanted sexual advances make on females of all ages. Most 17-year-old boys would probably forget or not recall jumping on a girl 36 years ago and trying to rip her clothes off. To them it would have been nothing more than a playful, maybe somewhat inebriated, antic.The men in the Senate who are protecting their nominee are also from the age where men were ignorant (many still are) of the impact unwanted sexual advances have on a woman. I applaud Ms. Ford for coming forward. This wasn't an easy choice for her.Fran KassabianAlameda, Calif.---""The vagaries of memory are well known,"" as you say. Perhaps Mr. Kavanaugh and Mark Judge, who were allegedly quite drunk, had their own memory lapse. Given that scenario, they could conceivably pass a lie detector test as well as Ms. Ford has. There is simply no way to know the truth for sure, and eventually we need to move on.Bruce BowersLos Altos, Calif.---Do you honestly believe that an allegation of sexual assault against a Supreme Court nominee should be glossed over? I've been a therapist for over 40 years and know it is extremely rare that women lie about this because they know the public humiliation Anita Hill endured and that Ms. Ford is about to. Imagine putting your entire sexual history on display on national TV and being grilled by hostile senators willing to say and insinuate anything. Get serious. Things like morality, integrity and honesty are more important than anyone's political career.John LardyTucson, Ariz.---One can debate Sen. Dianne Feinstein's questionable delay or whether Judge Kavanaugh may or may not have participated in some questionable behavior in high school. However, the real issue is whether anyone's stupid behavior in high school or college, short of a violent felony, should be considered when evaluating a person's capability and qualifications for serving in public office or any other position more than 30 years later. Millions of young people have done something stupid or behaved badly during their high school and college years. Most eventually mature and lead exemplary lives thereafter. If we believe in rehabilitation and redemption, we should judge people on their actions during adulthood. If we disqualify every person who behaved stupidly or badly in their youth, we are going to exclude many great people from public life.Stephan WilliamsWorcester, Mass.---This is why fewer than 35% of potential voters actually vote.Nate SachritzPortage, Mich."
wsj,"Sen. Feinstein, Clean Up Your Mess","Republicans and others who live in California and are appalled by the Senate's Brett Kavanaugh spectacle at least can do something about it. In November, they can hold their noses and pull the lever for Dianne Feinstein's ultraliberal challenger and thereby send the state's four-term Senate doyenne down to landslide defeat.Mrs. Feinstein's ending an otherwise a long and creditable career in humiliation and ignominy would be justice not only because of her culpable role in the Kavanaugh travesty. It would be poetic for her to finish under a real and recent cloud given actions that have cast a cloud over Judge Kavanaugh because of unprovable, last-minute claims about how he may have behaved in his teens.Mrs. Feinstein could learn something from the New York Times in its own debunking of the latest ill-sourced Kavanaugh allegation, in which the paper says it contacted dozens of potential witnesses and found none who would verify a complaint floated Sunday in backhanded fashion by the New Yorker magazine.Lesson: You don't need the FBI. Private investigators are available. Opposition researchers can be hired -- just not the Fusion GPS kind, who specialize in producing anonymous, unsubstantiated slurs rather than checking them out.The Senate Judiciary Committee and the Democratic Party have ample resources. In fact, Democrats can still do something to repair the damage, in partnership with Senate Republicans. If Mrs. Feinstein weren't so narrowed by her life in politics that she can't see a bigger picture, she would already have owned up to her failure in this regard and tried to clean up the mess.After all, she is the ranking Democrat on the Judiciary Committee. She could refuse to participate in Thursday's hearing. She could demand that it be called off. She could point out the obvious: A hearing in the absence of any attempt by the Senate to seek verifiable facts against which to measure the vague memories of accusant Christine Blasey Ford can only be a ""he said, she said"" travesty, a modern-day gladiatorial contest in which tribal loyalty and the loudest shouting will substitute for truth and justice.Whatever the truth of Mr. Kavanaugh's teenage behavior, this is not a creditworthy exercise in advise and consent. Judge Kavanaugh evidently feels obliged to go along rather than have a refusal be interpreted as guilt. He will be subjected to cross-examination by Senate Democrats in which he will be forced to admit that he drank beer in high school and went to parties. This will be more than enough for Sen. Mazie Hirono, who has already determined that Judge Kavanaugh is a liar because he's a man, and a rapist because as a judge he might uphold democratically enacted restrictions on abortion.Republicans are stuck playing for the mildest possible political disaster, which means pushing through Judge Kavanaugh's confirmation even while the allegations remain unresolved. But Republicans won't, for fear of increasing their jeopardy with women, subject Ms. Ford to the cross-examination that would be requisite in any truly fact-finding forum. They likely won't even challenge her behavior since the allegations surfaced, which has clearly seemed more aimed at conveniencing Democratic strategy in the midterms than at putting her testimony before the senators so they can assess it.Mrs. Feinstein so far has behaved as we expect politicians to behave on most occasions: as if there is no consideration higher than what she must do to assure her re-election. But she's 85 years old. She doesn't need another term in the Senate. She doesn't need one more ritual of incumbency validation.Since the glaring absence here is any context of facts in which her fellow senators can weigh the accusation that Sen. Feinstein allowed to be sprung on Judge Kavanaugh at the last minute, she should be the one to request that the nomination be briefly put on hold. She should propose that Democrats and Republicans jointly sponsor an investigator to take a week or two to question anybody and everybody who might have been present at the alleged party or know anything about the history of Judge Kavanaugh and Ms. Ford.Mrs. Feinstein could even agree, as a gesture of expiation and good faith, to support Judge Kavanaugh's confirmation if the investigation yields no information to support Ms. Ford's claim.Failing that, the right thing to do is spare Judge Kavanaugh and Ms. Ford an awful, purposeless hearing that cannot be anything but a disgrace to the Senate. Republicans should vote up or down based on what is on the record. Ms. Ford is free to tell her story to any senator who wants to hear it. She is free to tell it to the media as many times as she wants; she is not being denied a right to be heard. The media are free to chase down every allegation that she or anybody cares to make about Brett Kavanaugh.All this will not be satisfying, but it wouldn't get more satisfying as the result of Thursday's planned hearing. And at least the Senate will not be an agent of further disgracing itself in the process. Sen. Feinstein is the author of this abomination, whether she meant to be or not, and is the one who ought to call it off."
wsj,GOP Speeds Up Kavanaugh Vote,"The Senate Republican leadership is moving to expedite the final stages of Judge Brett Kavanaugh's nomination to the Supreme Court after Thursday's planned hearing featuring the woman who has accused him of sexual assault when they were teenagers.The Senate Judiciary Committee has scheduled a vote Friday on Judge Kavanaugh's nomination. Senate Majority Leader Mitch McConnell's office alerted senators they should be prepared to work over the weekend, suggesting the chamber could take a procedural vote that would clear the way for a final, full-Senate vote early next week.President Trump wants Judge Kavanaugh to take the seat of retired Justice Anthony Kennedy by Oct. 1, the start of the high court's next term. Republican lawmakers are also pressing to fill the lifetime appointment before the November midterm elections in which they are fighting to maintain their majorities in the House and Senate.""I think that it's going to be pretty hard to move this along without having votes on certainly Friday or Saturday, probably,"" said Sen. Orrin Hatch (R., Utah).Christine Blasey Ford, the California college professor who has accused the judge of sexually assaulting her when they were in high school during the 1980s, is set to appear Thursday before the Senate Judiciary Committee. Judge Kavanaugh, who has denied Dr. Ford's claims, is also scheduled to appear Thursday before the committee.Democrats are objecting to Republicans pushing forward on the nomination and vote without first having the Federal Bureau of Investigate Dr. Ford's allegations.""Republicans are already talking about rushing to a vote -- before we even got to this hearing, before there is an investigation, and while women are sharing more stories,"" Sen. Patty Murray (D., Wash.) said on Twitter.Committee rules require Chairman Chuck Grassley (R., Iowa) to issue a public notice of a meeting three days in advance. He also has the right to postpone it, which the committee did earlier this week as negotiations for Thursday's hearing showed progress.Mr. Trump is frustrated by the delay in the vote, a White House official said Tuesday. The president spoke with the Senate majority leader over the weekend, with Mr. McConnell explaining he had to accommodate certain senators who wanted to ensure that Dr. Ford gets a hearing, the official said.It wasn't clear if Republicans have the 50 votes needed to confirm Judge Kavanaugh. Republicans have a 51-49 majority in the Senate. To prevail, they can afford no more than one defection, assuming all Democratic caucus members oppose the nomination. If they lose one vote, they could then have Vice President Mike Pence break a tie.""I am not going to speculate on where I am. Our meetings certainly went well. He certainly has the credentials,"" Sen. Susan Collins (R., Maine) said Tuesday. ""But we now have a serious allegation made and I look forward to the hearing on Thursday.""Earlier Tuesday, the White House said it was open to congressional testimony from a second woman, who has accused Judge Kavanaugh of sexual aggression when he was a college student. There was no indication Senate Republicans would go along with that as a Thursday hearing set to include Dr. Ford and Judge Kavanaugh approached.""We would be open to that, and that process could take place on Thursday,"" White House spokeswoman Sarah Sanders said on ABC's ""Good Morning America,"" when asked whether the president wanted to hear from Deborah Ramirez, a Yale University classmate of the nominee.Ms. Ramirez's attorney, John Clune, told CNN on Tuesday that he was in contact with the Judiciary Committee but that Republicans declined to participate in a call until Ms. Ramirez sent more information. He said his client wants the FBI to investigate the allegations first before she provides more details to lawmakers.Her allegations couldn't be independently verified by The Wall Street Journal. Judge Kavanaugh, who spoke to Senate committee aides about the Ramirez accusation on Tuesday, has denied her claims.In a Fox News interview Monday, Judge Kavanaugh repeated his denials of Dr. Ford's claims and said, ""I've never sexually assaulted anyone. I did not have sexual intercourse or anything close to sexual intercourse in high school or for many years thereafter.""Steve Kantrowitz, a Yale classmate who is now a history professor at the University of Wisconsin-Madison, questioned that assertion. He wrote on Twitter Tuesday morning, ""Perhaps Brett Kavanaugh was a virgin for many years after high school. But he claimed otherwise in a conversation with me during our freshman year in Lawrance Hall at Yale, in the living room of my suite.""Mr. Kantrowitz said via email Tuesday that he posted the tweet because of the importance of ""honest and integrity"" in serving as a justice, and he remembered the conversation because it was surprising. Kerri Kupec, a White House spokeswoman, said Judge Kavanaugh spoke ""honestly and forthrightly"" in the Fox interview.""The press has been carrying Democrats' and Dr. Ford's narrative,"" a White House official said Tuesday. ""They haven't carried forward the clarity of the judge's denials. We thought having him on TV and presenting that to the country was important. That was the goal and that was what he accomplished.""After viewing the interview, people close to Judge Kavanaugh's nomination are recommending he show more feistiness in the hearing on Thursday and they have made that point to him."
