Media,title,article
wsj,Deal Sets Up Hearing on Kavanaugh --- Some details still under discussion as parties wrangle ahead of Thursday showdown,"The stage was set for a dramatic public hearing Thursday over sexual-assault allegations against Judge Brett Kavanaugh, with Democrats planning to delve broadly into the Supreme Court nominee's past and Republicans aiming to keep a narrow focus on the substance of the accusations.Lawyers for Christine Blasey Ford, Judge Kavanaugh's accuser, said Sunday that she would appear before the Senate Judiciary Committee at 10 a.m. Thursday and answer questions about her allegation that Judge Kavanaugh pinned her to a bed, groped her and tried to remove her clothing when they were teenagers. Judge Kavanaugh has denied the allegation.Details of the hearing were still being hammered out late Sunday, after days of wrangling and partisan positioning. The hearing would play a big role in determining whether Judge Kavanaugh, who many think would likely tilt the high court further to the right, is confirmed by the Republican-majority Senate.On Sunday evening, Sen. Dianne Feinstein of California, the committee's top Democrat, asked for an immediate postponement of the hearing after new allegations surfaced in an article in the New Yorker.Deborah Ramirez, a college classmate of Judge Kavanaugh, told the magazine that she remembered that Judge Kavanaugh had exposed himself to her at a drunken party when they were at Yale University. Judge Kavanaugh said in a statement Sunday that the alleged incident didn't happen, and the White House said it stood by the nominee.Judge Kavanaugh said, ""This is a smear, plain and simple.""The Wall Street Journal couldn't verify the allegations. Ms. Ramirez and her lawyer didnt return requests seeking comment.Looking ahead to the hearing, Democrats said that they plan to press Judge Kavanaugh, 53 years old, on his teenage drinking habits. Dr. Ford, now a 51-year-old college professor in California, has said she believes he was drunk when the incident she alleges occurred at a party when she was 15 and he was 17.""It's certainly relevant to the whole conversation. Dr. Ford has said that they were stumbling at the time that this occurred,"" Sen. Dick Durbin (D., Ill.), a member of the Judiciary Committee, said on ABC. ""There have been a lot of things said about the alcohol that was consumed by the judge as well as by others in his school. That has to be part of any relevant questioning.""Some Republicans, meanwhile, said Judge Kavanaugh's nomination shouldn't be derailed without sufficient evidence. ""Unless there's something more, no, I'm not going to ruin Judge Kavanaugh's life over this,"" Sen. Lindsey Graham (R., S.C.) said on Fox Sunday morning.The White House has developed a two-track approach for the hearing, a person close to the confirmation process said. Officials argue questions about Judge Kavanaugh's high-school drinking should be off-limits. If Democrats make such inquiries, similar questions should be asked of Dr. Ford, this person said.It isn't clear how much sway the White House can exert over the senators, but Judge Kavanaugh could decline to answer questions he considers out of bounds, the person said. In practice sessions, he has been prepping to do just that, said a Republican who has discussed the matter with White House officials.Over the weekend, Republicans stressed that in addition to Judge Kavanaugh, three people publicly identified as being at the party where the assault allegedly occurred said they don't recall it.A lawyer for Patrick Smyth, whose name surfaced in connection with the party last week, emailed the Judiciary Committee that he had ""no knowledge"" of the party and had ""never witnessed any improper conduct by Brett Kavanaugh towards women.""In addition, Judiciary Committee aides sent a letter to Leland Keyser on Tuesday, after the Washington Post reported that Dr. Ford said Ms. Keyser attended the party.In a letter to the committee, Ms. Keyser's attorney, Howard Walsh, said, ""Simply put, Ms. Keyser does not know Mr. Kavanaugh and she has no recollection of ever being at a party or gathering where he was present, with, or without, Dr. Ford."" Ms. Keyser told the Post, however, that she believed Dr. Ford's allegations.Debra Katz, a lawyer for Dr. Ford, said the lack of recollection isn't surprising. ""As Dr. Ford has said, she did not share her story publicly or with anyone for years following the incident with Judge Kavanaugh,"" she said in a statement. ""It's not surprising that Ms. Keyser has no recollection of the evening as they did not discuss it.""Judge Kavanaugh also plans to turn over calendar records from his teenage years that don't include an entry for the sort of party that Dr. Ford described, a person familiar with the process said.Among several points of contention late Sunday, Republicans said they would insist on a key point: that outside lawyers, in addition to senators, be allowed to question Dr. Ford and Judge Kavanaugh. Dr. Ford has objected to fending off questions from anyone other than lawmakers.Republican lawmakers and White House officials have privately said they are worried about the optics of the 11 male GOP senators on the Judiciary Committee questioning a woman who is alleging she was sexually assaulted. Sen. Graham said on Fox that a designated lawyer would ferret out more information.""We've got 11 politicians who haven't done a trial in about 20 years,"" said Sen. Graham, adding, ""I thought it would be really smart to have somebody come in who knows what the hell they're doing, to ask the questions, to be respectful.""Four of the 10 Democratic Judiciary members are women, and they argue Republicans are seeking to hide the lack of Republican women on the committee. Democrats are also continuing to press for other witnesses at the hearing, including Mark Judge, who Dr. Ford has said was present during the alleged assault. A lawyer for Mr. Judge said in a letter to the Judiciary Committee last week that he has no memory of the alleged incident and doesn't want to testify.Sen. Chuck Grassley (R., Iowa), the committee's chairman, suggested he wouldn't yield on these points. ""The Committee determines which witnesses to call, how many witnesses to call, in what order to call them, and who will question them,"" Mr. Grassley's aides said in a statement.---Terms & ConditionsLawyers and congressional aides have spent days haggling over the terms of Thursday's hearing featuring Supreme Court nominee Brett Kavanaugh and Christine Blasey Ford, who has accused him of sexual assault in the 1980s. The judge has denied the allegations.Republicans have agreed to some of Dr. Ford's requests; others remain in dispute. Here's a further look:What has been settled:-- The hearing will begin at 10 a.m. Thursday. There will be a break every 45 minutes, with additional breaks as requested.-- Dr. Ford will have a dedicated security team and will have two lawyers at the table with her while testifying.-- Dr. Ford and Judge Kavanaugh won't be in the hearing room at the same time.-- Dr. Ford will testify first, giving Judge Kavanaugh a chance to defend himself against the specifics of her allegations.-- Democratic lawmakers will question Judge Kavanaugh themselves.-- Senators from each side will be given the same number of rounds of questions, with an equal number of minutes per round.-- Limited access for TV cameras and other media.What remains unresolved:-- Who will question Dr. Ford on the GOP side? Republicans want to use female staff attorneys or outside counsel to question Dr. Ford before senators do, but her lawyers are resisting that.-- How long will senators ask questions? That's still being determined.-- Who will testify? Republicans say only Dr. Ford and Judge Kavanaugh should appear. Democrats want additional witnesses including Mark Judge, whom Dr. Ford says was in the room during the assault; a former FBI agent who gave her a polygraph test; and trauma experts.-- Kristina Peterson"
wsj,FBI Report Fuels GOP Confidence --- Two key lawmakers signal approval of a reopened investigation into Judge Kavanaugh,"WASHINGTON -- Republican leaders said they were increasingly confident Thursday that Supreme Court nominee Brett Kavanaugh would win confirmation after a reopened FBI investigation into allegations of sexual misconduct ended without new concerns being raised by the handful of undecided senators.Judge Kavanaugh faces a critical procedural vote Friday morning, which is expected to forecast the tally of the final confirmation vote on Saturday. Democrats, infuriated by the limits of the Federal Bureau of Investigation probe into allegations leveled against him, have grown gloomier at the prospect of losing the wrenching national fight over a seat that would tip the balance of the high court to the right.After weeks in limbo, Judge Kavanaugh's confirmation picked up momentum Thursday after Sens. Jeff Flake of Arizona and Susan Collins of Maine, two of the three undecided GOP senators, said they found the FBI investigation to be thorough.Asked whether he now had enough information to confirm Judge Kavanaugh, Mr. Flake -- who last week was prepared to vote for the nominee -- suggested the report contained no new evidence supporting the sexual-misconduct allegations.""I'm still reviewing the information, but we've seen no additional information yet -- no additional corroborating information,"" Mr. Flake said. Ms. Collins praised the FBI for completing a ""very thorough investigation,"" though she said she was still reviewing the documents.The third publicly undecided Republican, Sen. Lisa Murkowski of Alaska, gave no signal of her leanings on Thursday. If all Democrats vote no, Republicans, who hold a 51-49 advantage in the Senate, can afford to lose no more than one of their own troops.Entering the final stretch of the bitter fight over Judge Kavanaugh, Democrats said FBI agents had failed to conduct a legitimate investigation because they hadn't interviewed all relevant witnesses. The bureau questioned nine witnesses and contacted a tenth to produce the 46-page report that was delivered to the Capitol at 2:30 a.m. Thursday.The FBI didn't interview Christine Blasey Ford, the California college psychology professor who accused Judge Kavanaugh of assaulting her at a party when they were teenagers, Democrats noted.The FBI did speak with Deborah Ramirez, who told the New Yorker an inebriated Judge Kavanaugh exposed himself to her when they were in college. Her lawyer, however, said she named more than 20 individuals ""likely to have relevant information,"" and the FBI contacted few if any of them.Judge Kavanaugh has denied the allegations lodged by Dr. Ford and Ms. Ramirez, saying he has never sexually assaulted anyone and characterizing the accusations as a political smear.Democrats ridiculed what they described as the probe's skimpiness. ""All of our worst fears about this being incomplete in the extreme have been justified,"" said Sen. Brian Schatz (D., Hawaii). ""It's like you lose your keys in your apartment and you only look on the bathroom floor and you decide the keys are gone.""Friday's procedural vote on Judge Kavanaugh was set to divide largely along party lines. Sen. Heidi Heitkamp of North Dakota, a Democrat running for re-election in a conservative state, said Thursday she would oppose Judge Kavanaugh, leaving Sen. Joe Manchin of West Virginia as the only undecided Democrat.Lawmakers from both parties predicted Mr. Manchin, also up for re-election in a state won by Republican President Trump, would end up backing Mr. Kavanaugh. GOP senators and aides were optimistic that Mr. Flake also would vote for Judge Kavanaugh. In the event of a 50-50 tie, Vice President Mike Pence would cast a vote to break the impasse.Although some strategists initially believed Ms. Collins's support for abortion rights made her a possible no vote, she has praised Judge Kavanaugh and said she doesn't believe he would overturn the Roe v. Wade abortion case.Among Republicans, the biggest question mark remained Ms. Murkowski, who was steadfastly noncommittal Thursday. She won an unusual write-in re-election victory eight years ago, leaving her liberated from the GOP hierarchy. Some of the Alaska Natives who helped fuel her victory oppose Judge Kavanaugh because of a case in which he questioned whether constitutional protections for Native American tribes should extend to Native Hawaiians, a view they fear could threaten similar protections enjoyed by Alaskan Natives.All day Thursday, senators streamed in and out of the secure room in the Capitol complex where they could examine a single copy of the FBI report, whose 12 sections were distributed among whichever lawmakers were present. Senators had to sign up for specific time slots to review the FBI's findings, which they were permitted to discuss publicly only in vague terms.The White House renewed its calls to move forward. Senators ""have been given ample time to review this seventh background investigation,"" said White House spokesman Raj Shah, referring to earlier FBI background probes of Judge Kavanaugh.Lawyers for Dr. Ford said they were ""profoundly disappointed"" that the FBI didn't speak to her. ""An FBI supplemental background investigation that did not include an interview of Dr. Christine Blasey Ford -- nor the witnesses who corroborate her testimony -- cannot be called an investigation,"" said Michael Bromwich, an attorney for Dr. Ford.The FBI questioned several people who Dr. Ford said were at the house party when she was allegedly assaulted, including Judge Kavanaugh's friend Mark Judge, who was said to be in the room during the alleged assault, and P.J. Smyth, a football teammate, as well as Dr. Ford's friend Leland Keyser.Democrats had listed about two dozen individuals they said should be interviewed to support or disprove the allegations, but the FBI didn't question most of them."
wsj,"GOP, Accuser Dig In On Terms --- Grassley says vote on Kavanaugh would go ahead if talks fail to resolve disagreements","WASHINGTON -- Negotiations between Republicans and lawyers for the woman accusing Judge Brett Kavanaugh of sexual assault stretched into late Friday, with both sides trying to shape terms of a hearing next week that would likely determine whether the Supreme Court nominee is confirmed.Late Friday, there were several points of contention: the day of the week; whether Judge Kavanaugh or his accuser, California professor Christine Blasey Ford, would speak first; and whether other people would be brought in to testify and to question the witnesses.In a statement Friday evening, Senate Judiciary Committee Chairman Chuck Grassley (R., Iowa) told Dr. Ford's attorneys that if they didn't respond later Friday night, the panel would go ahead and vote on the nominee Monday. ""We cannot continue to delay,"" Mr. Grassley said in the statement.Dr. Ford's attorney asked for an additional day to respond, saying her client had been meeting with the Federal Bureau of Investigation about death threats she had been receiving, and needed more time.Meantime, President Trump weighed in more aggressively Friday, challenging Dr. Ford's account against his Supreme Court nominee.As Republican lawmakers conferred on how to respond to the conditions Dr. Ford's attorneys listed for her to testify, it was uncertain whether the disputes would derail the chance that she would agree to appear before the Senate Judiciary Committee. Dr. Ford, 51 years old, alleges that while they were both in high school in the early 1980s, Judge Kavanaugh, 53, groped her and tried to remove her clothes after he and a friend pulled her into a room. Judge Kavanaugh has strongly denied the allegations.Republican lawmakers earlier had offered Wednesday, not Thursday, which Dr. Ford's lawyers requested. They rejected Dr. Ford's request that Judge Kavanaugh speak first in the hearing, saying they wanted the nominee to have a chance to respond to her accusations. And they objected to bringing in other people to testify besides Judge Kavanaugh and Dr. Ford, as Democrats and Dr. Ford's lawyers want.GOP lawmakers also are pushing for outside counsels -- rather than solely the lawmakers on the committee -- to question Dr. Ford and Judge Kavanaugh in any hearing. Dr. Ford's legal team has opposed that idea, saying the senators themselves should ask the questions.Among other things, Democrats believe Republicans are trying to avoid the image of the committee's 11 male GOP senators interrogating a woman who is alleging sexual assault. GOP senators say it makes sense to have legal professionals asking question.Republicans on the Judiciary Committee hope to vote on Judge Kavanaugh's confirmation within days or weeks, with a vote by the full Senate to follow shortly after that. The Supreme Court begins hearing cases on Oct. 1, with the Nov. 6 midterms looming shortly after that. Most political analysts believe Democrats have a chance, albeit a slim one, of retaking control of the Senate, where Republicans hold a 51-49 edge. That would create much more difficult terrain for the Republican Mr. Trump to get a Supreme Court nominee approved.In a tweet Friday, Mr. Trump signaled a tougher strategy against Dr. Ford. ""I have no doubt that, if the attack on Dr. Ford was as bad as she says, charges would have been immediately filed with local Law Enforcement Authorities by either her or her loving parents,"" Mr. Trump tweeted. ""I ask that she bring those filings forward so that we can learn date, time, and place!""Dr. Ford's attorney, Debra Katz, didn't respond to questions about the tweet. Dr. Ford's parents didn't return a call seeking comment.Experts say sexual-assault victims often don't come forward for years, if ever. The Rape, Abuse & Incest National Network says about two-thirds of sexual assaults aren't reported to law enforcement.After Dr. Ford came forward with the allegation publicly last Sunday, the president for several days largely confined his comments to praising Judge Kavanaugh, saying Dr. Ford should be heard, and urging that any delay in the confirmation process be brief.Some areas of agreement did emerge Friday. Republicans appear willing to accommodate a request from Dr. Ford's attorneys to ensure the security of their client, who has received threats since coming forward. Dr. Ford, a psychology professor at Palo Alto University in California, planned to meet with Federal Bureau of Investigation agents Friday in San Francisco about the threats.But the two sides remained apart in other areas. Democrats want to summon to testify Mark Judge, whom Dr. Ford has named as a friend of Judge Kavanaugh's and the only other person in the room during the alleged assault. Republicans oppose hearing from Mr. Judge.Despite the turbulence, Senate Majority Leader Mitch McConnell (R., Ky.) expressed confidence Friday that Judge Kavanaugh's confirmation was on track. ""You watch the fight, you watch the tactics, but here's what I want to tell you: In the very near future, Judge Kavanaugh will be"" on the Supreme Court, he told a conference for social conservatives in WashingtonSen. Maggie Hassan (D., N.H.) took issue with those comments. ""They are saying that even if Dr. Ford comes forward and tells her story . . . they don't care,"" she said on CNN."
