Media,title,article
wsj,GOP Forges Ahead on Court Pick,"WASHINGTON -- Republicans rallied around embattled Supreme Court nominee Brett Kavanaugh, vowing Monday to push his confirmation through the Senate even as a new allegation of sexual misconduct emerged days before a hearing on an earlier assault claim.Senate Majority Leader Mitch McConnell (R., Ky.) took to the Senate floor to call the allegations a ""smear campaign"" and promise a vote on the Senate floor to confirm the judge ""in the near future."" President Trump, in New York for a United Nations meeting Monday, reiterated his support for his second Supreme Court pick, saying, ""I am with him all the way.""The judge and his wife, Ashley Estes Kavanaugh, also took part in a Fox News interview Monday evening, using the forum to combat depictions of him as a predatory high school and college student, telling the network that he was a virgin into his 20s.""We're talking about an allegation of sexual assault,"" he said. ""I've never sexually assaulted anyone. I did not have sexual intercourse or anything close to sexual intercourse in high school or for many years thereafter.""Christine Blasey Ford, a California college professor, has accused him of sexually assaulting her when they were in high school during the 1980s. Judge Kavanaugh again denied the accusation but didn't question why Dr. Ford hadn't raised the issue publicly before now -- something President Trump has done.He said he wasn't worried about losing Mr. Trump's backing. The president called him on Monday, he said, and told him ""he's standing by me.""White House officials cast Judge Kavanaugh's Fox interview as part of a weeklong campaign to build momentum for his nomination that has been losing ground in public opinion. They plan to deploy high-ranking female officials in TV appearances, including press secretary Sarah Sanders and Kellyanne Conway, counselor to the president, a White House official said Monday.A WSJ/NBC survey released last week found that 38% of registered voters oppose the Kavanaugh nomination, up from 29% in a Journal/NBC poll last month.Democrats on the Senate Judiciary Committee renewed their call for postponing a hearing scheduled for Thursday that will feature testimony from Judge Kavanaugh and Dr. Ford.Judge Kavanaugh, in a letter to Senate Judiciary Committee Chairman Charles Grassley (R., Iowa), said he ""will not be intimidated into withdrawing"" his name from consideration for the vacancy created by the retirement of Justice Anthony Kennedy.A letter from Dr. Ford to Mr. Grassley was also released Monday in which she agreed to appear before the committee despite death threats and being tailed while driving. ""While I am frightened, please know, my fear will not hold me back from testifying and you will be provided with answers to all of your questions. I ask for fair and respectful treatment,"" she wrote, saying also that Judge Kavanaugh's alleged actions ""have had a lasting impact on my life.""Democrats are also urging Mr. Grassley to investigate allegations from Deborah Ramirez, who told the New Yorker in an article published Sunday that she recalled Judge Kavanaugh exposing himself to her at a drunken party when they were both students at Yale University in the 1980s.Her allegations couldn't be independently verified by The Wall Street Journal. Ms. Ramirez's attorney declined to comment on Monday.While some people cited in the article backed up parts of Ms. Ramirez's account, others disputed it and Mr. Kavanaugh denied it. GOP lawmakers and aides said Monday that without stronger corroboration, Ms. Ramirez's account wouldn't derail Judge Kavanaugh, although a GOP aide said the Judiciary Committee reached out to Ms. Ramirez's attorney after the allegations surfaced and hadn't received a response.Democrats said the Federal Bureau of Investigation could provide answers that politicians could not in questioning witnesses at the Senate hearing. The White House and the GOP have opposed having the FBI look further into the allegations.""There is only one way to get to the bottom of these allegations against Judge Kavanaugh and prevent the nation from being thrown into further turmoil: an independent background check investigation by the FBI,"" Senate Minority Leader Chuck Schumer (D., N.Y.) said Monday.The typical FBI background check -- even for the most sensitive government positions -- doesn't take into account much information before a nominee was 18, aside from verifying basic biographical information such as birthplace and birth date, according to people familiar with the process.While the GOP rallied behind its president's nominee, Senate Republicans said it wasn't clear if there will be enough support to confirm Judge Kavanaugh, with undecided Republican senators -- including Susan Collins of Maine, Lisa Murkowski of Alaska and Jeff Flake of Arizona -- waiting to assess his performance on Thursday. Republicans have a 51-49 Senate majority, so Judge Kavanaugh can afford no more than one defection, assuming all Democrats vote against him.Meanwhile, unease was growing over the effect the ugly, high-profile fight may have on November's elections. In their effort to retain control of the House after the midterms, Republicans have been specifically courting women, who hold less favorable views of Judge Kavanaugh than men, according to the latest Wall Street Journal/NBC News poll.The new allegation from Ms. Ramirez surfaced just as lawyers for Dr. Ford, a 51-year-old psychology professor at Palo Alto University, reached an agreement with Judiciary Committee Republicans to appear at a hearing Thursday.Some details are still being negotiated, including the rounds of questions, after days of wrangling and partisan positioning, but it appeared set to happen as of Monday evening.Democrats plan to go beyond Dr. Ford's specific allegation to press Judge Kavanaugh, 53, on his teenage drinking habits."
wsj,Main Street: It's Susan Collins's Moment,"If Brett Kavanaugh were on trial for sexual assault, all he'd need do is demonstrate reasonable doubt about the charges being made against him. But a Republican nominee to the Supreme Court is tried in the media, where Mr. Kavanaugh must now do the impossible: prove an assault never happened.Christine Blasey Ford alleges that at a high-school party 36 years ago, 17-year-old Brett Kavanaugh pinned her to a bed, tried to remove her clothes, and covered her mouth so she couldn't scream. Ms. Ford, now a professor at California's Palo Alto University, says she was able to flee the room only after a friend of Mr. Kavanaugh's, Mark Judge, jumped on top of them and they all tumbled off the bed. Ms. Ford further says she didn't tell anyone what happened at the time.Judge Kavanaugh's denial is categorical: ""I have never done anything like what the accuser describes -- to her or anyone,"" he said in a statement Monday. Mr. Judge likewise denies it all. ""It's just absolutely nuts,"" he told the Weekly Standard. ""I never saw Brett act that way.""The truth is, no one knows what went on in that Maryland bedroom at that party -- or if Mr. Kavanaugh was even there. Absent corroborating testimony, even the Federal Bureau of Investigation would have no way to reveal much more.So here we are, just days before what should have been a Thursday vote in the Senate Judiciary Committee. Since Ms. Ford's name became public, one member of that committee, Jeff Flake, the retiring Republican from Arizona, announced he wouldn't feel comfortable going ahead with a vote without a fuller airing of Ms. Ford's complaint. In a committee of 11 Republicans and 10 Democrats, Mr. Flake would give the Democrats the majority they need to stall a vote.Republicans Bob Corker, the retiring senator from Tennessee, and Alaska's Lisa Murkowski have also come out against holding a vote until Ms. Ford can be heard. They are joined by Democratic incumbents facing tight election races in states carried by Donald Trump: Joe Donnelly (Ind.), Heidi Heitkamp (N.D.) and Joe Manchin (W.Va.). Though Democrats would love to kill the Kavanaugh nomination, the more practical aim is a lengthy delay that would spare these Democrats a tough vote before the November midterms.But there's another senator who may hold the key to whether the GOP hangs together or heads for the tall grass. On Sunday Maine Republican Susan Collins told the New York Times that she considers the allegations of sexual assault serious and wants Ms. Ford interviewed to get her whole story. Just as telling, she made clear she finds the low and the last-minute nature of the way the Democrats handled the charges fishy.""If they believed Professor Ford, why didn't they surface this information earlier so that he could be questioned about it?"" Ms. Collins said. ""And if they didn't believe her and chose to withhold the information, why did they decide at the 11th hour to release it? It is really not fair to either of them the way it was handled.""Ms. Collins's complaints about fairness aren't easily dismissed. She's a strong advocate for women's rights; she announced in 2016 she wouldn't vote for Donald Trump; and she hasn't been afraid to buck her party, as when she voted against ObamaCare repeal. She's also firmly pro-choice but recently stood up to a nasty crowdfunding effort to bribe her into voting against Judge Kavanaugh over claims he would overturn Roe v. Wade.In remarks to reporters Monday afternoon, Ms. Collins called for accuser and accused to testify before the Judiciary Committee under oath. Not long after that, the Judiciary Committee scheduled a one-day hearing Monday on the issue. Ms. Ford and Judge Kavanaugh will each be heard.This is a risky accommodation, because the media and Democrats won't be satisfied no matter what Republicans do. But if it provides the space GOP senators need to move ahead to confirm Judge Kavanaugh, it may be the least damaging accommodation. The test is whether the hearing serves the purpose of keeping confirmation process close to schedule, or whether it will be turn into what the Democrats are really pushing for: the first of many delaying actions to come -- what one Judiciary Committee staffer describes as ""Borking 2.0.""By all means let's hear what Ms. Ford has to say. But let us hope Ms. Collins insists it not be at the expense of fairness to Judge Kavanaugh. Because right now the effort to put off his confirmation votes seems aimed at establishing an odious, new post-hearing precedent, whereby a single, inconclusive and uncorroborated #MeToo accusation can upend all Senate norms and leave a man with an otherwise sterling reputation twisting in the wind."
wsj,Committee Vote Yields High Drama,"WASHINGTON -- After the raw and riveting hearing Thursday on sexual assault allegedly committed by a teenage Brett Kavanaugh, Friday's committee vote was expected to be an anticlimax, allowing senators to repeat calcified views before voting 11-10 along party lines to send President Trump's Supreme Court nominee to the Senate floor.Instead, the previous day's spectacle gave way to intrigue, as events in and around the Dirksen Senate Office Building's wood-paneled Room 226 turned an apparent fait accompli into a fast-moving drama centering on Sen. Jeff Flake, a retiring Republican from Arizona.Throughout the Dirksen building and the larger Capitol complex, anti-Kavanaugh protesters clogged corridors, staffers congregated around television monitors or stared at smartphones to follow the hearing, and senators sought to navigate -- physically as well as politically -- the perils posed by the nomination.Mr. Flake's frequent criticism of Mr. Trump and often-conciliatory stance toward the opposition made him the sole Republican on the Senate Judiciary Committee who Democrats thought might tilt against Judge Kavanaugh, particularly after Thursday's testimony by Christine Blasey Ford, the California professor who said the assault had scarred her for life. Judge Kavanaugh emotionally denied the allegations.Four minutes before the committee's 9:30 a.m. meeting time, Mr. Flake appeared to eliminate any suspense with an emailed press release pledging to vote for Judge Kavanaugh.""I wish that I could express the confidence that some of my colleagues have conveyed about what either did or did not happen in the early 1980s, but I left the hearing yesterday with as much doubt as certainty,"" his statement said. And a tie goes to the accused, whose conservative legal views align with his, Mr. Flake reasoned.Bringing down the gavel, committee chairman Sen. Chuck Grassley (R., Iowa) sought to move quickly through procedures that could send Judge Kavanaugh's nomination to a floor vote.It turned out, however, that the real action had occurred in a building elevator, where two women confronted Mr. Flake minutes after he announced support for Judge Kavanaugh, telling him that they, too, had been sexually assaulted.""You're telling all women that they don't matter, that they should just stay quiet, because if they tell you what happened to them, you are going to ignore them,"" one said.Mr. Flake entered the hearing room, but word quickly spread about the dramatic encounter. When Mr. Flake, visibly pained, abruptly left the room, rumors spread that he was reconsidering his support for Judge Kavanaugh.The hearing's tenor changed shortly before 1 p.m., when Mr. Grassley declared the committee would stand ""at ease until the fall of the gavel."" Silence replaced rancor as senators began to disappear through the mirrored rear door leading to their anteroom, and it became clear that something was going on.The specified vote time of 1:30 p.m. came and went. Then, as abruptly as he had left, Mr. Flake returned. He had no deal to announce, just his own position: He would vote to recommend Judge Kavanaugh to the full Senate -- but wouldn't vote to confirm him on the floor without a weeklong delay to let the FBI investigate Dr. Ford's allegations.""This country is being ripped apart here,"" he said. His position, he said, was an effort to mend that tear."
wsj,A Stumble Down Memory Lane,"Christine Blasey Ford has told the world that Brett Kavanaugh sexually assaulted her 36 years ago, when they were 15 and 17, respectively. Because it was so long ago, she doesn't know where or when the alleged assault occurred. But she says she knows what Mr. Kavanaugh did to her, in graphic detail.The judge denies her accusations categorically. He attests that he has never treated any woman in the manner Ms. Ford says he treated her. All of Ms. Ford's three named witnesses don't recall any such party; one denies knowing Judge Kavanaugh.Now, one of Judge Kavanaugh's Yale classmates, Deborah Ramirez, has accused him of lewd conduct at a freshman-year dorm party. ""She was at first hesitant to speak publicly, partly because her memories contained gaps because she had been drinking,"" the magazine asserts. She ""felt confident"" of her story only ""after six days of carefully assessing her memories and consulting with her attorney."" Again, Judge Kavanaugh denies her allegations categorically.What to do? The common assumption in such he-said/she-said disputes is that we can assess the disputants' credibility and believability based on how they conduct themselves under questioning. Yet there are strong reasons to resist taking the bait on saying who is being truthful. In both these cases, as in many other public pronouncements of sexual misconduct, the scientific literature does not offer guidance on declaring who is misremembering -- or lying, which implies an intent to deceive.The literature instead strongly supports deferring to long-honored legal requirements for judging the truthfulness of accusers and defenders by assessing claims with verifiable evidence. Relying solely on accusations and denials is fraught with potential error.Memories are subject to serious flaws, given the limitations and imperfections of the biological and psychological processes of recording, retaining and recalling them. Memories aren't computer files with exacting recall and retrieval functions. They are often disassembled and stored in ""packets"" in multiple brain locations. People don't store the fine details of all daily experiences, because of neuron capacity limitations. Even important details can be missed or lost.Hence the brain must be selective in which memories it stores and must condense them so that many details are left out. Many eyewitnesses and even victims of crimes don't take note of the facial features of gun-toting assailants or the make and color of getaway cars.In retrieving memories, people reassemble them and -- as Ms. Ramirez did in consultation with her lawyer -- fill in the blanks in the condensed version. That process is fraught with the risk of error, especially when heavy drinking or drugs are involved. Crime victims who forget key facial features of their assailants can distort their recalled and reassembled memories so thoroughly that they accuse the wrong person of the actual crime. See the parade of longtime prisoners released because DNA tests prove them innocent.The more remote a memory is in time, the less reliable it tends to be, partly because of decay and partly because recalled memories can be corrupted by new information. New and old memories can be conflated, sometimes emerging as totally false memories. Memories can be warped by leading questions from therapists, lawyers, journalists or others.My colleague Elizabeth Loftus was able to ""implant"" false memories in a significant subset of laboratory subjects by showing them an official-looking poster of Disney characters, including Mickey Mouse and Bugs Bunny. Many subjects later remembered meeting Bugs Bunny on a childhood trip to Disneyland. Some of them even reported that Bugs had touched them inappropriately.That was impossible. Bugs Bunny isn't a Disney character.Along with the unreliability of memory, there is the difficulty of determining whether someone is lying. Evolutionary biologists claim that over the eons people have honed lying and cheating skills -- scholars call them ""tactical deception"" -- as survival and reproductive strategies. If given several costless or profitable chances to lie, many people will do so, with little hesitation and often convincingly. According to one study, some people can't go 10 minutes without lying. Lying on resumes, especially about educational credentials, is rampant, according to research.No doubt some people resist strong temptations to lie, but liars can be good at faking sincerity. Without additional evidence, it is very difficult to tell who's lying and who's telling the truth. Witnesses in courts and congressional hearings are threatened with potentially brutal cross-examinations and with up to five years in prison for perjury. You'd think that would be enough to stop anyone from lying under oath. Yet the number of perjury prosecutions in federal courts alone has ranged from 250 to 645 a year over the last decade.When the stakes are high, people simply can't be taken at their words alone -- and neither can they be called liars without evidence. That's especially the case when raw politics can infiltrate memories from long ago.Pundits have drawn a line between Judge Kavanaugh and his accusers, and insisted Americans take sides. But there is a third way: Remain agnostic until you know whether the accusations are backed by independent corroborating evidence. Without corroboration the public -- and members of congressional committees -- can't know whether a memory is authentic or is a product of some other process."
wsj,Upward Mobility: The Mitchell Memo's Devastating Conclusions,"Rachel Mitchell, the outside prosecutor hired by Senate Republicans, took some heat last week for the methodical manner in which she questioned Christine Blasey Ford, the college professor who has accused Supreme Court nominee Brett Kavanaugh of sexual assault when they were in high school more than 35 years ago. Supporters of Judge Kavanaugh had expected Ms. Mitchell to be more combative, but she was more interested in being thorough. Now we know why.On Sunday Ms. Mitchell sent senators a nine-page memo outlining her assessment of Ms. Ford's testimony, and the portrait she paints of the accuser is devastating. Ms. Mitchell writes that Ms. Ford ""has not offered a consistent account of the alleged assault"" -- when it happened and what occurred -- and has even ""struggled to identify Judge Kavanaugh as the accuser by name.""""A 'he said, she said' case is incredibly difficult to prove,"" writes Ms. Mitchell. ""But this case is even weaker than that. Dr. Ford identified other witnesses to the event, and those witnesses either refuted her allegations or failed to corroborate them."" One of those supposed witnesses is Leland Keyser, a lifelong friend of Ms. Ford, whose attorney has stated: ""Simply put, Ms. Keyser does not know Mr. Kavanaugh and she has no recollection of ever being at a party or gathering where he was present, with, or without, Dr. Ford.""Sexual-assault victims, we are told, sometimes experience memory lapses, and given the amount of time that has passed since the alleged event occurred in the early 1980s, it's no surprise that Ms. Ford doesn't remember every detail. What's remarkable is how Democrats on the Senate Judiciary Committee have attempted to turn her inconsistent statements and memory lapses into a virtue. By their logic, the hazier the recollection, the more credible the allegation.Ms. Mitchell, who has been prosecuting sex-related and other crimes for nearly a quarter-century, isn't buying it. Whether the witness looked or sounded like someone who believed what she was saying matters less than whether her account can be corroborated. Ms. Ford's memory loss seems rather selective and her inconsistencies have piled up -- not only over the past three decades but also over the past three months. In early July she told the Washington Post that the assault occurred in the ""mid-1980s."" Later that month, she told Sen. Dianne Feinstein that it occurred in the ""early 80s."" By September, Ms. Ford was convinced that she was attacked in the ""summer of 1982."" ""While it is common for victims to be uncertain about dates,"" writes Ms. Mitchell, ""Dr. Ford failed to explain how she was suddenly able to narrow the timeframe to a particular season and particular year.""Ms. Ford, who possesses two master's degrees and a doctorate, claims that she knew how to contact her congresswoman but not her senator. She says she struggled academically in college due to the assault, but makes no claim of struggling through her final two years of high school. Even her age at the time of the alleged incident has varied in her descriptions over the years. In 2013 she told a therapist it happened in her ""late teens."" Now she says it happened when she was 15. And so on.Majority Leader Mitch McConnell said Monday that the Senate will start voting this week on the nomination, and let's hope he means it this time. Judge Kavanaugh has denied Ms. Ford's allegations, and the other women who have come forward have been even less credible. The only thing we seem to have established is that Judge Kavanaugh drank -- sometimes to excess, when he was young -- which he doesn't deny and which isn't evidence that he sexually assaulted Ms. Ford or anyone else.Assenting to the FBI investigation was a mistake. The Republicans know that it is a mostly redundant exercise intended to postpone a vote until after the midterm elections, not determine what did or didn't happen 36 years ago. Agents are re-interviewing people who were already contacted by Senate staffers. Judge Kavanaugh's six previous background checks over the past 25 years have turned up nothing, let alone something this serious. What would be fishy is if the seventh background check turned out any differently.Predictably, Democrats have used the delay to argue that a one-week investigation is insufficient and that the probe's scope is too limited. They've also decided, based on Judge Kavanaugh's response to some of the allegations, that he lacks the right ""temperament"" for a Supreme Court justice. The bigger concern for the country might be the temperament of Senate Democrats who are so willing and eager to dispense with due process in order to prevent President Trump from filling a Supreme Court vacancy."
